{
  "preset_id": "youtube_shorts",
  "platform": "YouTube",
  "display_name": "YouTube — Shorts",
  "description": "YouTube Shorts. Deliberately minimal: YouTube classifies a Short on exactly two measurable properties and publishes no separate Shorts encoding specification at all.",
  "origin": "shipped",
  "ruleset_version": "2026-08-09.1",
  "last_verified_date": "2026-08-09",
  "byte_convention": "Decimal bytes (1 GB = 1,000,000,000).",
  "caveats": [
    "YouTube classifies a video as a Short on two properties only: a square or vertical aspect ratio, and a duration of up to 3 minutes. Both are reported as information because they determine how the video is categorised, not whether it is accepted.",
    "No separate Shorts codec, bitrate, file-size or minimum-resolution specification is published. Standard-upload encoding recommendations are deliberately NOT inherited here, because doing so would invent Shorts requirements that YouTube has never stated.",
    "The two platform-wide limits that do apply — the supported container list and the 256 GB ceiling — are enforced.",
    "The often-quoted 1080x1920 Shorts resolution is industry convention, not a published YouTube specification."
  ],
  "sources": [
    {
      "source_ref": "Y-S6",
      "title": "Understand three-minute YouTube Shorts, YouTube Help",
      "url": "https://support.google.com/youtube/answer/15424877?hl=en",
      "access_date": "2026-08-09",
      "confidence": "HIGH"
    },
    {
      "source_ref": "Y-S7",
      "title": "Get started creating YouTube Shorts, YouTube Help",
      "url": "https://support.google.com/youtube/answer/10059070?hl=en",
      "access_date": "2026-08-09",
      "confidence": "MEDIUM"
    },
    {
      "source_ref": "Y-S2",
      "title": "Supported YouTube file formats",
      "url": "https://support.google.com/youtube/troubleshooter/2888402?hl=en",
      "access_date": "2026-08-09",
      "confidence": "HIGH"
    },
    {
      "source_ref": "Y-S5",
      "title": "Upload videos longer than 15 minutes, YouTube Help",
      "url": "https://support.google.com/youtube/answer/71673?hl=en",
      "access_date": "2026-08-09",
      "confidence": "HIGH"
    }
  ],
  "rules": [
    {
      "rule_id": "youtube_shorts.container_supported",
      "property": "container.format",
      "operator": "in",
      "expected": [
        "mov", "mpeg", "mpeg1", "mpeg2", "mp4", "avi", "wmv", "mpegps", "flv",
        "3gp", "webm", "mkv", "dnxhr", "prores", "cineform"
      ],
      "classification": "HARD_REQUIREMENT",
      "severity": "FAIL",
      "explanation": "The file type must be on YouTube's supported-formats list. This limit is platform-wide, not Shorts-specific.",
      "source_ref": "Y-S2",
      "confidence": "HIGH",
      "last_verified_date": "2026-08-09"
    },
    {
      "rule_id": "youtube_shorts.max_file_size",
      "property": "file.size_bytes",
      "operator": "lte",
      "expected": 256000000000,
      "classification": "DOCUMENTED_LIMIT",
      "severity": "FAIL",
      "explanation": "The maximum file size you can upload is 256 GB. This limit is platform-wide, not Shorts-specific.",
      "source_ref": "Y-S5",
      "confidence": "HIGH",
      "last_verified_date": "2026-08-09"
    },
    {
      "rule_id": "youtube_shorts.classification_aspect_ratio",
      "property": "video.display_aspect_ratio",
      "operator": "lte",
      "expected": 1.0,
      "tolerance": 0.01,
      "classification": "UNKNOWN",
      "severity": "INFO",
      "explanation": "A video is categorised as a Short only if it has a square or vertical aspect ratio.",
      "note": "This determines how YouTube categorises the video, not whether it is accepted. A wider ratio simply uploads as a long-form video.",
      "source_ref": "Y-S6",
      "confidence": "HIGH",
      "last_verified_date": "2026-08-09"
    },
    {
      "rule_id": "youtube_shorts.classification_duration",
      "property": "file.duration_seconds",
      "operator": "lte",
      "expected": 180,
      "classification": "UNKNOWN",
      "severity": "INFO",
      "explanation": "A video is categorised as a Short only if it is up to three minutes long.",
      "note": "This determines categorisation, not acceptance. A longer video uploads as a long-form video.",
      "source_ref": "Y-S6",
      "confidence": "HIGH",
      "last_verified_date": "2026-08-09"
    },
    {
      "rule_id": "youtube_shorts.recommended_aspect_ratio",
      "property": "video.display_aspect_ratio",
      "operator": "eq",
      "expected": 0.5625,
      "tolerance": 0.01,
      "classification": "BEST_PRACTICE",
      "severity": "WARN",
      "explanation": "A 9:16 vertical aspect ratio is prioritised for Shorts.",
      "message_fail": "This is general guidance. Any square-or-vertical ratio still classifies as a Short.",
      "source_ref": "Y-S7",
      "confidence": "MEDIUM",
      "last_verified_date": "2026-08-09"
    },
    {
      "rule_id": "youtube_shorts.encoding_spec_absent",
      "property": "video.codec",
      "operator": "present",
      "classification": "UNKNOWN",
      "severity": "INFO",
      "explanation": "Video codec, reported for information.",
      "note": "YouTube publishes no Shorts-specific codec, bitrate, file-size or minimum-resolution specification. PreflightQC deliberately does not apply standard-upload encoding recommendations here.",
      "source_ref": "Y-S6",
      "confidence": "LOW",
      "last_verified_date": "2026-08-09"
    }
  ]
}
